{
  "eas_version": "0.1",
  "schema_version": "0.1.0",
  "implementation": {
    "name": "eas-reference-fixture",
    "version": "0.1.0",
    "adapter": "hand-authored-example",
    "adapter_version": "0.1.0"
  },
  "environment": {
    "name": "deterministic-fixture",
    "revision": "1"
  },
  "started_at": "2026-07-11T00:00:00Z",
  "completed_at": "2026-07-11T00:01:00Z",
  "record_created_at": "2026-07-11T00:02:00Z",
  "run_id": "run-example-escalated-001",
  "task": {
    "description": "Publish the current draft to a public standards website.",
    "primary_class": "operate",
    "secondary_classes": [],
    "candidate_classes": ["operate"],
    "classification_basis": "The requested outcome would create an external publication effect.",
    "acceptance_criteria": ["The intended publication authority and license are known."]
  },
  "initial_state": {
    "summary": "A private working draft exists; publication authority and license are undecided.",
    "revision": "sha256:example-private-draft"
  },
  "constraints": ["Do not publish without authority and a license decision."],
  "assumptions": [],
  "state_history": ["RECEIVED", "UNDERSTANDING", "ESCALATED"],
  "actions": [],
  "decisions": [
    {
      "id": "decision-1",
      "question": "May the draft be publicly published under a specific license?",
      "options": ["Publish", "Request owner decision"],
      "choice": "Request owner decision",
      "disposition": "escalate",
      "basis": "Publication changes external state and the required authority and license are unresolved.",
      "risk": "high",
      "reversibility": {
        "level": "partial",
        "mechanism": "Retract or replace the publication where the selected channel permits.",
        "limitations": ["Audience exposure and downstream copies cannot be recalled."]
      },
      "authority": "escalated",
      "evidence_refs": ["evidence-1"]
    }
  ],
  "evidence": [
    {
      "id": "evidence-1",
      "kind": "inspection",
      "description": "The charter lists license and publication governance as open decisions.",
      "result": "observed",
      "source": "CHARTER.md",
      "origin": "environment",
      "capture": "direct",
      "observed_at": "2026-07-11T00:01:00Z",
      "recorded_at": "2026-07-11T00:02:00Z"
    }
  ],
  "final_state": {
    "summary": "No publication occurred; owner direction was requested.",
    "revision": "sha256:example-private-draft"
  },
  "outcome": "escalated",
  "task_result": "not_satisfied",
  "report": {
    "summary": "Publication requires an owner decision on authority and license.",
    "changes": [],
    "verification": [],
    "limitations": ["The publication target and license are unresolved."],
   "unresolved": ["Select a license and authorize or reject public publication."]
  },
  "mapping": {
    "unmapped_events": [],
    "assumptions": [],
    "indeterminate_properties": []
  }
}
