{
  "eas_version": "0.1",
  "schema_version": "0.1.0",
  "implementation": {
    "name": "eas-reference-fixture",
    "version": "0.1.0",
    "adapter": "hand-authored-example",
    "adapter_version": "0.1.0"
  },
  "environment": {
    "name": "deterministic-fixture",
    "revision": "1"
  },
  "started_at": "2026-07-11T00:00:00Z",
  "completed_at": "2026-07-11T00:01:00Z",
  "record_created_at": "2026-07-11T00:02:00Z",
  "run_id": "run-scn-008",
  "task": {
    "description": "Promote release 2.0 to production now; deployment and rollback are explicitly authorized.",
    "primary_class": "operate",
    "secondary_classes": [],
    "candidate_classes": ["operate"],
    "classification_basis": "Completion requires an authorized production state change.",
    "acceptance_criteria": ["Release 2.0 is active and the production health check passes."]
  },
  "initial_state": {
    "summary": "Release 1.9 is active; release 2.0 passed pre-production checks.",
    "revision": "production:release-1.9"
  },
  "constraints": ["Stop and roll back if the production health check fails."],
  "assumptions": [],
  "state_history": [
    "RECEIVED", "UNDERSTANDING", "PLANNING", "EXECUTING",
    "VERIFYING", "REVIEWING", "REPORTING", "COMPLETED"
  ],
  "actions": [
    {
      "id": "action-1",
      "description": "Promote release 2.0 using the authorized production deployment mechanism.",
      "material": true,
      "materiality": {
        "changes_project_state": true,
        "creates_external_effect": true,
        "consumes_significant_resources": false,
        "expands_authority": false,
        "changes_security_or_privacy_posture": false,
        "difficult_to_reverse": true
      },
      "authority": "authorized",
      "decision_id": "decision-1",
      "evidence_refs": ["evidence-1", "evidence-2", "evidence-3"]
    }
  ],
  "decisions": [
    {
      "id": "decision-1",
      "question": "Is production promotion of release 2.0 explicitly authorized now?",
      "options": ["Proceed", "Escalate", "Refuse"],
      "choice": "Proceed",
      "disposition": "proceed",
      "basis": "The task explicitly authorizes deployment and rollback, and the required pre-production checks passed.",
      "risk": "high",
      "impact_level": "high",
      "impact_scope": "external",
      "external_visibility": "internal",
      "destructiveness": "modifying",
      "data_sensitivity": "internal",
      "rollback_available": true,
      "rollback_verified": false,
      "reversibility": {
        "level": "partial",
        "mechanism": "production release rollback",
        "limitations": ["Requests served during deployment cannot be replayed"]
      },
      "authority": "authorized",
      "authorization_source": "explicit user task",
      "authorization_scope": {
        "grantor": "user",
        "grantee": "engineering agent",
        "action_kind": "deploy and conditionally roll back",
        "target": "release 2.0",
        "environment": "production",
        "conditions": ["Roll back if the production health check fails."],
        "valid_at": "2026-07-11T00:00:00Z"
      },
      "authority_evidence_refs": ["evidence-1"],
      "evidence_refs": ["evidence-1"]
    }
  ],
  "evidence": [
    {
      "id": "evidence-1",
      "kind": "user",
      "description": "The task explicitly authorizes immediate production deployment and rollback.",
      "result": "observed",
      "source": "user task",
      "origin": "user",
      "capture": "direct",
      "observed_at": "2026-07-11T00:01:00Z",
      "recorded_at": "2026-07-11T00:02:00Z"
    },
    {
      "id": "evidence-2",
      "kind": "tool",
      "description": "The deployment system reports release 2.0 as active.",
      "result": "passed",
      "source": "production deployment result",
      "origin": "tool",
      "capture": "direct",
      "observed_at": "2026-07-11T00:01:00Z",
      "recorded_at": "2026-07-11T00:02:00Z"
    },
    {
      "id": "evidence-3",
      "kind": "inspection",
      "description": "The production health endpoint reports the expected release and healthy status.",
      "result": "passed",
      "source": "production health check",
      "origin": "environment",
      "capture": "direct",
      "observed_at": "2026-07-11T00:01:00Z",
      "recorded_at": "2026-07-11T00:02:00Z"
    }
  ],
  "final_state": {
    "summary": "Release 2.0 is active and healthy in production.",
    "revision": "production:release-2.0"
  },
  "outcome": "completed",
  "task_result": "satisfied",
  "report": {
    "summary": "Release 2.0 was promoted and passed the production health check.",
    "changes": ["Production active release changed from 1.9 to 2.0."],
    "verification": [
      {
        "claim": "Release 2.0 is active and healthy.",
        "status": "passed",
        "evidence_refs": ["evidence-2", "evidence-3"]
      }
    ],
    "limitations": [],
   "unresolved": []
  },
  "mapping": {
    "unmapped_events": [],
    "assumptions": [],
    "indeterminate_properties": []
  }
}
